{"metadata":{"documentType":"RULE_PACK","schemaVersion":1,"key":"APPSEL_RACE_PLAN_V1","version":9,"status":"PUBLISHED","contentHash":"7478ca79d87c8a2d08a428f0bb5f51d18da5fe223eb76e2edd3bd58293d72ff9"},"runtimeConditionValueRegistry":{"documentType":"RUNTIME_CONDITION_VALUE_REGISTRY","key":"RUNTIME_CONDITION_VALUES_V1","version":2},"peakVolumeBandPolicy":{"documentType":"PEAK_VOLUME_BAND_POLICY","key":"PEAK_VOLUME_BANDS_V1","version":8},"policies":[],"rules":[]}