{
  "metadata": {
    "documentType": "RULE_PACK",
    "schemaVersion": 1,
    "key": "APPSEL_RACE_PLAN_V1",
    "version": 7,
    "status": "VALIDATED"
  },
  "runtimeConditionValueRegistry": {
    "documentType": "RUNTIME_CONDITION_VALUE_REGISTRY",
    "key": "RUNTIME_CONDITION_VALUES_V1",
    "version": 2
  },
  "peakVolumeBandPolicy": {
    "documentType": "PEAK_VOLUME_BAND_POLICY",
    "key": "PEAK_VOLUME_BANDS_V1",
    "version": 6
  },
  "policies": [],
  "rules": []
}
