{"metadata":{"documentType":"RULE_PACK","schemaVersion":1,"key":"APPSEL_RACE_PLAN_V1","version":4,"status":"PUBLISHED","contentHash":"81cfa30346e9c0c763cc6c30a97c1f8ebc847f074b06e9f866df4c006d96c640"},"runtimeConditionValueRegistry":{"documentType":"RUNTIME_CONDITION_VALUE_REGISTRY","key":"RUNTIME_CONDITION_VALUES_V1","version":2},"peakVolumeBandPolicy":{"documentType":"PEAK_VOLUME_BAND_POLICY","key":"PEAK_VOLUME_BANDS_V1","version":3},"policies":[],"rules":[]}