{"metadata":{"documentType":"RULE_PACK","schemaVersion":1,"key":"APPSEL_RACE_PLAN_V1","version":6,"status":"PUBLISHED","contentHash":"8af8f3670365936cd246839ffcc8fe23e8a36502b4dd2665b450803f1bb109af"},"runtimeConditionValueRegistry":{"documentType":"RUNTIME_CONDITION_VALUE_REGISTRY","key":"RUNTIME_CONDITION_VALUES_V1","version":2},"peakVolumeBandPolicy":{"documentType":"PEAK_VOLUME_BAND_POLICY","key":"PEAK_VOLUME_BANDS_V1","version":5},"policies":[],"rules":[]}